{
  "id": "floor-0",
  "name": "Ground Floor",
  "floorNumber": 0,
  "buildingId": "B-11",
  "buildingName": "North Tower",
  "floorPlanImage": "/data/buildings/B-11/floors/floor-0-plan.jpeg",
  "units": [
    {
      "unitNumber": "001",
      "modelId": "A-3",
      "modelTitle": "A Modern 3-Bedroom Apartment",
      "availability": "available",
      "pricing": {
        "price": 22000
      },
      "polygon": [
        426.9671441154685,
        285.95726854231833,
        426.9671441154685,
        132.83807143638649,
        517.286301855373,
        132.83807143638649,
        517.991920275216,
        104.61333464266633,
        912.5487179696684,
        103.99306901440465,
        913.0788595322852,
        197.82812559758398,
        956.5504676668654,
        198.88840872281764,
        957.6107507920991,
        405.64361814338224,
        855.2934292070505,
        406.70390126861594,
        853.7030045192,
        458.65777440506554,
        479.9532028743333,
        459.7180575302992,
        479.4230613117164,
        335.6649318779604,
        442.843293491155,
        336.19507344057723,
        443.37343505377186,
        285.3014834293613
      ]
    },
    {
      "unitNumber": "002",
      "modelId": "A-3",
      "modelTitle": "A Modern 3-Bedroom Apartment",
      "availability": "available",
      "pricing": {
        "price": 10000
      },
      "polygon": [
        957.9538747973586,
        198.29514450789534,
        1001.9203059677568,
        198.69514450789535,
        1002.4603928754648,
        105.26010947439676,
        1397.2639224100744,
        104.17993565898058,
        1398.3440962254906,
        132.26445485980096,
        1489.0786967204485,
        132.29215208268025,
        1489.618783628157,
        287.26939737202116,
        1475.5765240277467,
        287.26939737202116,
        1472.8760894892062,
        335.87721906574876,
        1435.6100928573485,
        336.41730597345685,
        1435.6100928573485,
        459.01703402319197,
        1060.789778907938,
        460.63729474631623,
        1059.7096050925218,
        404.4682563446754,
        999.1741355204827,
        405.6885170677997,
        959.1741355204825,
        405.6885170677997
      ]
    },
    {
      "unitNumber": "003",
      "modelId": "A-3",
      "modelTitle": "A Modern 3-Bedroom Apartment",
      "availability": "available",
      "pricing": {
        "price": 120000
      },
      "polygon": [
        479.04980700549754,
        623.858003193165,
        853.7328839347865,
        622.5932657823913,
        854.7148601306194,
        678.074920846949,
        957.6795277918596,
        678.0258220371572,
        956.7868221592844,
        883.3481175294867,
        913.49059897938,
        883.3481175294868,
        913.0442461630923,
        978.4212673987611,
        518.0220037485019,
        979.3139730313364,
        518.0220037485019,
        951.193745605213,
        426.519676409529,
        950.7473927889254,
        426.0733235932413,
        798.0947296185412,
        442.4698480639191,
        798.0947296185412,
        442.0501914436738,
        746.7588165062504,
        480.0222162633768,
        747.0022816787709
      ]
    },
    {
      "unitNumber": "004",
      "modelId": "A-3",
      "modelTitle": "A Modern 3-Bedroom Apartment",
      "availability": "available",
      "pricing": {
        "price": 1200000
      },
      "polygon": [
        958.72401242412,
        677.5976582154215,
        1060.76401242412,
        677.5176582154214,
        1061.0843244241198,
        621.4436322154214,
        1436.65525642412,
        623.3320402154214,
        1434.97735842412,
        747.3308002154214,
        1473.4969864241198,
        747.4192082154215,
        1473.17488442412,
        797.9008142154215,
        1489.6904944241203,
        797.2334262154213,
        1489.7440844241203,
        950.2362882154215,
        1397.2129644241204,
        949.9434682154215,
        1397.5057844241203,
        977.4685482154215,
        1001.3203244241201,
        977.1757282154216,
        1001.6131444241202,
        883.7661482154216,
        958.0614244241201,
        883.1805082154216
      ]
    }
  ]
}