{
  "id": "81c27e1a-f86a-420a-82db-e0a3e7536b6e",
  "name": "Ground Floor",
  "floorNumber": 0,
  "buildingId": "A-12",
  "buildingName": "Residence",
  "floorPlanImage": "/data/buildings/A-12/floors/floor-0-plan.jpeg",
  "units": [
    {
      "unitNumber": "001",
      "modelId": "A-2",
      "modelTitle": "Elegant 2-Bedroom Suite",
      "availability": "available",
      "pricing": {
        "price": 12000
      },
      "polygon": [
        373.2069730604892,
        122.6185873062809,
        890.2714852708066,
        124.8913983489636,
        889.1350797494653,
        410.1291842056442,
        959.5922220726294,
        412.4019952483269,
        957.3194110299467,
        574.9079848001409,
        887.9986742281238,
        577.1807958428237,
        886.8622687067825,
        866.9642037848696,
        856.1793196305658,
        866.9642037848696,
        855.0429141092245,
        960.149456534861,
        601.6244828501019,
        959.0130510135195,
        601.6244828501019,
        902.1927749464517,
        370.9341620178065,
        898.7835583824276
      ]
    },
    {
      "unitNumber": "002",
      "modelId": "A-2",
      "modelTitle": "Elegant 2-Bedroom Suite",
      "availability": "available",
      "pricing": {
        "price": 13000
      },
      "polygon": [
        1551.382343974953,
        121.0510597971825,
        1547.625631507709,
        900.5688967503444,
        1315.6486366553822,
        895.8730061662892,
        1314.7094585385712,
        955.0412275253847,
        1063.009723233213,
        955.9804056421957,
        1061.131366999591,
        864.8801283115249,
        1029.1993110280157,
        865.819306428336,
        1028.2601329112047,
        574.674090216914,
        961.5784866176209,
        573.734912100103,
        961.5784866176209,
        410.31791977498233,
        1028.2601329112047,
        410.3179197749824,
        1030.1384891448267,
        121.99023791399355
      ]
    }
  ]
}